文本序号,用户名,版本号,时间,成员角色,text,issue_topic,score,tag
0,stevqin,1.2.3-rc02,2023-03-26 00:23:21,NONE,有没有发现升级到1.2.3后，jdbc连接 fe抽取数据速度明显变慢呢？,[Bug] doris-1.2.x版本使用超过32个union all导致be节点挂掉,0,version;do
1,liujiwen-up,1.2.3-rc02,2023-03-28 10:08:44,CONTRIBUTOR, 有没有发现升级到1.2.3后，jdbc连接 fe抽取数据速度明显变慢呢？【测试】了一下，没发现该现象呀,[Bug] doris-1.2.x【版本】使用超过32个union all导致be节点挂掉,-1,problem;test;do
2,liujiwen-up,1.2.3-rc02,2023-03-28 10:49:04,CONTRIBUTOR,"The 【problem】 has not been reproduced, more information can be provided, and you can chat with me privately and add me on WeChat：Ljw919666",[Bug] doris-1.2.x【版本】使用超过32个union all导致be节点挂掉,-1,problem;do
3,stevqin,1.2.3-rc02,2023-03-28 10:53:08,NONE,  有没有发现升级到1.2.3后，jdbc连接 fe抽取数据速度明显变慢呢？  【测试】了一下，没发现该现象呀我这边出现了这个情况；出现 jdbc连接fe抽取数据变慢的情况后，又尝试 重新【替换】 BE 程序，FE程序 问题依旧；直接换回 1.2.2 【版本】后，jdbc抽取数据恢复正常。,[Bug] doris-1.2.x版本使用超过32个union all导致be节点挂掉,-1,version;problem;replace;test;try;do
4,deaftstill,1.2.3-rc02,2023-03-28 11:00:35,NONE AUTHOR, 有没有发现升级到1.2.3后，jdbc连接 fe抽取数据速度明显变慢呢？还没仔细测这方面，晚上试试,[Bug] doris-1.2.x【版本】使用超过32个union all导致be节点挂掉,0,version;do
5,Yulei-Yang,1.2.3-rc02,2023-03-30 08:21:58,CONTRIBUTOR,"we have the same 【problem】, and generated a 130+G core file",[Bug] doris-1.2.x版本使用超过32个union all导致be节点挂掉,-1,problem;do
6,xinyiZzz,1.2.3-rc02,2023-04-04 19:22:34,CONTRIBUTOR,@deaftstill 超过32个 union all 稳定复现么，方便的话贴下SQL之前其他人报过一样的栈，关闭profile后就没【问题】了，怀疑和频繁创建线程有关,[Bug] doris-1.2.x版本使用超过32个union all导致be节点挂掉,-1,problem;do
